{"airports": [{"code": "LHR", "name": "LHR", "latitude": 51.4775, "longitude": -0.461389, "taxiTimeInMinutes": {}, "languages": ["en"]}, {"code": "JFK", "name": "JFK", "latitude": 40.639722, "longitude": -73.778889, "taxiTimeInMinutes": {}, "languages": ["en"]}, {"code": "CNF", "name": "CNF", "latitude": -19.624444, "longitude": -43.971944, "taxiTimeInMinutes": {}, "languages": ["pt", "en"]}, {"code": "BRU", "name": "BRU", "latitude": 50.901389, "longitude": 4.484444, "taxiTimeInMinutes": {}, "languages": ["fr", "nl", "en"]}, {"code": "ATL", "name": "ATL", "latitude": 33.636667, "longitude": -84.428056, "taxiTimeInMinutes": {}, "languages": ["en"]}, {"code": "BNE", "name": "BNE", "latitude": -27.383333, "longitude": 153.118333, "taxiTimeInMinutes": {}, "languages": ["en"]}], "employees": [{"id": "0", "name": "Dan Long", "homeAirport": "LHR", "skills": ["Captain"], "languages": ["en", "fr"], "unavailableDays": ["2026-07-01"], "typeRatings": ["A320", "A350"], "seniority": 668, "isReserve": false, "preferredDaysOff": ["2026-07-02"], "undesiredAirports": []}, {"id": "1", "name": "Gus Hood", "homeAirport": "LHR", "skills": ["First officer"], "languages": ["en", "fr"], "unavailableDays": [], "typeRatings": ["A320", "A350"], "seniority": 421, "isReserve": false, "preferredDaysOff": ["2026-07-07"], "undesiredAirports": []}, {"id": "2", "name": "Nick Fox", "homeAirport": "LHR", "skills": ["First officer"], "languages": ["en", "fr"], "unavailableDays": [], "typeRatings": ["A320", "A350"], "seniority": 255, "isReserve": false, "preferredDaysOff": [], "undesiredAirports": []}, {"id": "3", "name": "Dena Clay", "homeAirport": "LHR", "skills": ["Senior cabin attendant"], "languages": ["en"], "unavailableDays": ["2026-07-06"], "typeRatings": ["A320", "A350"], "seniority": 511, "isReserve": false, "preferredDaysOff": ["2026-07-01"], "undesiredAirports": []}, {"id": "4", "name": "Gus Fox", "homeAirport": "LHR", "skills": ["Cabin attendant"], "languages": ["en", "fr"], "unavailableDays": [], "typeRatings": ["A320", "A350"], "seniority": 249, "isReserve": false, "preferredDaysOff": ["2026-07-07"], "undesiredAirports": []}, {"id": "5", "name": "Dino Poe", "homeAirport": "LHR", "skills": ["Cabin attendant"], "languages": ["en"], "unavailableDays": ["2026-07-04"], "typeRatings": ["A320", "A350"], "seniority": 428, "isReserve": false, "preferredDaysOff": [], "undesiredAirports": []}, {"id": "6", "name": "Elsa Howe", "homeAirport": "LHR", "skills": ["Captain"], "languages": ["en", "fr"], "unavailableDays": [], "typeRatings": ["A320", "A350"], "seniority": 579, "isReserve": false, "preferredDaysOff": [], "undesiredAirports": []}, {"id": "7", "name": "Dan Haas", "homeAirport": "LHR", "skills": ["First officer"], "languages": ["en"], "unavailableDays": ["2026-07-01"], "typeRatings": ["A320", "A350"], "seniority": 923, "isReserve": false, "preferredDaysOff": ["2026-07-06", "2026-07-03"], "undesiredAirports": ["JFK"]}, {"id": "8", "name": "Dena Fox", "homeAirport": "LHR", "skills": ["First officer"], "languages": ["en"], "unavailableDays": [], "typeRatings": ["A320", "A350"], "seniority": 96, "isReserve": false, "preferredDaysOff": ["2026-07-02", "2026-07-04"], "undesiredAirports": []}, {"id": "9", "name": "Lino Poe", "homeAirport": "LHR", "skills": ["Senior cabin attendant"], "languages": ["en"], "unavailableDays": [], "typeRatings": ["A320", "A350"], "seniority": 587, "isReserve": false, "preferredDaysOff": [], "undesiredAirports": []}, {"id": "10", "name": "Flo Howe", "homeAirport": "LHR", "skills": ["Cabin attendant"], "languages": ["en", "fr"], "unavailableDays": ["2026-07-03"], "typeRatings": ["A320", "A350"], "seniority": 819, "isReserve": false, "preferredDaysOff": ["2026-07-07"], "undesiredAirports": []}, {"id": "11", "name": "Dena Howe", "homeAirport": "LHR", "skills": ["Cabin attendant"], "languages": ["en"], "unavailableDays": [], "typeRatings": ["A320", "A350"], "seniority": 541, "isReserve": false, "preferredDaysOff": [], "undesiredAirports": []}, {"id": "12", "name": "Dana Smith", "homeAirport": "LHR", "skills": ["Captain"], "languages": ["en", "fr"], "unavailableDays": [], "typeRatings": ["A320", "A350"], "seniority": 980, "isReserve": true, "preferredDaysOff": ["2026-07-05"], "undesiredAirports": []}, {"id": "13", "name": "Ivy Poe", "homeAirport": "LHR", "skills": ["First officer"], "languages": ["en", "nl"], "unavailableDays": [], "typeRatings": ["A320", "A350"], "seniority": 131, "isReserve": true, "preferredDaysOff": [], "undesiredAirports": []}, {"id": "14", "name": "Josh Smith", "homeAirport": "LHR", "skills": ["Cabin attendant"], "languages": ["en"], "unavailableDays": [], "typeRatings": ["A320", "A350"], "seniority": 62, "isReserve": true, "preferredDaysOff": ["2026-07-02", "2026-07-03"], "undesiredAirports": []}, {"id": "15", "name": "Dave Carr", "homeAirport": "JFK", "skills": ["Captain"], "languages": ["en"], "unavailableDays": [], "typeRatings": ["A320", "A350"], "seniority": 765, "isReserve": false, "preferredDaysOff": ["2026-07-03"], "undesiredAirports": []}, {"id": "16", "name": "Avis Wise", "homeAirport": "JFK", "skills": ["First officer"], "languages": ["en", "pt"], "unavailableDays": [], "typeRatings": ["A320", "A350"], "seniority": 217, "isReserve": false, "preferredDaysOff": [], "undesiredAirports": ["BNE"]}, {"id": "17", "name": "Flo Cole", "homeAirport": "JFK", "skills": ["First officer"], "languages": ["en"], "unavailableDays": [], "typeRatings": ["A320", "A350"], "seniority": 264, "isReserve": false, "preferredDaysOff": [], "undesiredAirports": []}, {"id": "18", "name": "Dan Wise", "homeAirport": "JFK", "skills": ["Senior cabin attendant"], "languages": ["en"], "unavailableDays": [], "typeRatings": ["A320", "A350"], "seniority": 802, "isReserve": false, "preferredDaysOff": ["2026-07-04"], "undesiredAirports": []}, {"id": "19", "name": "Avis Rye", "homeAirport": "JFK", "skills": ["Cabin attendant"], "languages": ["en"], "unavailableDays": [], "typeRatings": ["A320", "A350"], "seniority": 900, "isReserve": false, "preferredDaysOff": ["2026-07-02"], "undesiredAirports": []}, {"id": "20", "name": "Gus Li", "homeAirport": "JFK", "skills": ["Cabin attendant"], "languages": ["en"], "unavailableDays": [], "typeRatings": ["A320", "A350"], "seniority": 339, "isReserve": false, "preferredDaysOff": [], "undesiredAirports": []}, {"id": "21", "name": "Otha Hood", "homeAirport": "JFK", "skills": ["Captain"], "languages": ["en"], "unavailableDays": [], "typeRatings": ["A320", "A350"], "seniority": 451, "isReserve": false, "preferredDaysOff": [], "undesiredAirports": ["BNE"]}, {"id": "22", "name": "Amy Green", "homeAirport": "JFK", "skills": ["First officer"], "languages": ["en", "nl"], "unavailableDays": [], "typeRatings": ["A320", "A350"], "seniority": 116, "isReserve": false, "preferredDaysOff": ["2026-07-05", "2026-07-02"], "undesiredAirports": []}, {"id": "23", "name": "Nick Horn", "homeAirport": "JFK", "skills": ["First officer"], "languages": ["en"], "unavailableDays": ["2026-07-02"], "typeRatings": ["A320", "A350"], "seniority": 623, "isReserve": false, "preferredDaysOff": [], "undesiredAirports": []}, {"id": "24", "name": "Josh King", "homeAirport": "JFK", "skills": ["Senior cabin attendant"], "languages": ["en", "pt"], "unavailableDays": [], "typeRatings": ["A320", "A350"], "seniority": 787, "isReserve": false, "preferredDaysOff": [], "undesiredAirports": []}, {"id": "25", "name": "Dino Cole", "homeAirport": "JFK", "skills": ["Cabin attendant"], "languages": ["en", "fr"], "unavailableDays": [], "typeRatings": ["A320", "A350"], "seniority": 848, "isReserve": false, "preferredDaysOff": [], "undesiredAirports": []}, {"id": "26", "name": "Carl Green", "homeAirport": "JFK", "skills": ["Cabin attendant"], "languages": ["en"], "unavailableDays": ["2026-07-06"], "typeRatings": ["A320", "A350"], "seniority": 465, "isReserve": false, "preferredDaysOff": [], "undesiredAirports": ["BNE"]}, {"id": "27", "name": "Dana Watt", "homeAirport": "JFK", "skills": ["Captain"], "languages": ["en", "fr"], "unavailableDays": [], "typeRatings": ["A320", "A350"], "seniority": 877, "isReserve": true, "preferredDaysOff": [], "undesiredAirports": []}, {"id": "28", "name": "Dan Green", "homeAirport": "JFK", "skills": ["First officer"], "languages": ["en", "nl"], "unavailableDays": [], "typeRatings": ["A320", "A350"], "seniority": 818, "isReserve": true, "preferredDaysOff": ["2026-07-03"], "undesiredAirports": []}, {"id": "29", "name": "Hope Long", "homeAirport": "JFK", "skills": ["Cabin attendant"], "languages": ["en"], "unavailableDays": ["2026-07-04"], "typeRatings": ["A320", "A350"], "seniority": 426, "isReserve": true, "preferredDaysOff": [], "undesiredAirports": []}, {"id": "30", "name": "Josh Carr", "homeAirport": "BRU", "skills": ["Captain"], "languages": ["fr", "nl", "en", "pt"], "unavailableDays": [], "typeRatings": ["A320", "A350"], "seniority": 653, "isReserve": false, "preferredDaysOff": ["2026-07-05"], "undesiredAirports": ["ATL"]}, {"id": "31", "name": "Jay Hood", "homeAirport": "BRU", "skills": ["First officer"], "languages": ["fr", "nl", "en"], "unavailableDays": [], "typeRatings": ["A320", "A350"], "seniority": 818, "isReserve": false, "preferredDaysOff": ["2026-07-05", "2026-07-02"], "undesiredAirports": []}, {"id": "32", "name": "Otha Li", "homeAirport": "BRU", "skills": ["First officer"], "languages": ["fr", "nl", "en", "pt"], "unavailableDays": ["2026-07-01"], "typeRatings": ["A320", "A350"], "seniority": 181, "isReserve": false, "preferredDaysOff": ["2026-07-06"], "undesiredAirports": ["CNF"]}, {"id": "33", "name": "Dave King", "homeAirport": "BRU", "skills": ["Senior cabin attendant"], "languages": ["fr", "nl", "en", "pt"], "unavailableDays": ["2026-07-05"], "typeRatings": ["A320", "A350"], "seniority": 265, "isReserve": false, "preferredDaysOff": [], "undesiredAirports": []}, {"id": "34", "name": "Otha Cole", "homeAirport": "BRU", "skills": ["Cabin attendant"], "languages": ["fr", "nl", "en"], "unavailableDays":